{"OrganisatieCode":0,"ClientGegevens":{"Elementen":[{"Bdsnummer":19,"Waarde":"2"},{"Bdsnummer":20,"Waarde":"19890121"},{"Bdsnummer":82,"Waarde":273},{"Bdsnummer":91,"Waarde":"1"},{"Bdsnummer":110,"Waarde":2950},{"Bdsnummer":238,"Waarde":1640},{"Bdsnummer":240,"Waarde":1790}],"Groepen":[{"Elementen":[{"Bdsnummer":63},{"Bdsnummer":71},{"Bdsnummer":62,"Waarde":"01"}]},{"Elementen":[{"Bdsnummer":63,"Waarde":"19610722"},{"Bdsnummer":71},{"Bdsnummer":62,"Waarde":"02"}]}]},"Referentie":"Laura S","Contactmomenten":[{"Tijdstip":"19890121","Elementen":[{"Bdsnummer":235,"Waarde":480},{"Bdsnummer":245,"Waarde":2950}]},{"Tijdstip":"19890227","Elementen":[{"Bdsnummer":235,"Waarde":535},{"Bdsnummer":245,"Waarde":4180},{"Bdsnummer":252,"Waarde":376},{"Bdsnummer":879,"Waarde":1},{"Bdsnummer":881,"Waarde":2},{"Bdsnummer":883,"Waarde":2},{"Bdsnummer":884,"Waarde":1},{"Bdsnummer":885,"Waarde":1},{"Bdsnummer":927,"Waarde":1},{"Bdsnummer":928,"Waarde":2},{"Bdsnummer":955,"Waarde":1},{"Bdsnummer":956,"Waarde":1},{"Bdsnummer":958,"Waarde":1},{"Bdsnummer":959,"Waarde":1},{"Bdsnummer":961,"Waarde":1},{"Bdsnummer":964,"Waarde":1},{"Bdsnummer":966,"Waarde":1}]},{"Tijdstip":"19910205","Elementen":[{"Bdsnummer":235,"Waarde":900},{"Bdsnummer":245,"Waarde":13900},{"Bdsnummer":252,"Waarde":500},{"Bdsnummer":902,"Waarde":1},{"Bdsnummer":903,"Waarde":1},{"Bdsnummer":906,"Waarde":1},{"Bdsnummer":907,"Waarde":1},{"Bdsnummer":909,"Waarde":3},{"Bdsnummer":910,"Waarde":1},{"Bdsnummer":912,"Waarde":1},{"Bdsnummer":921,"Waarde":3},{"Bdsnummer":940,"Waarde":3},{"Bdsnummer":943,"Waarde":3},{"Bdsnummer":945,"Waarde":1},{"Bdsnummer":986,"Waarde":1},{"Bdsnummer":989,"Waarde":1},{"Bdsnummer":991,"Waarde":1},{"Bdsnummer":993,"Waarde":1}]}]}
